{
  "$schema": "./rules.schema.json",
  "version": 1,
  "title": "Quy tắc tuân thủ quy hoạch từ dưới lên",
  "updated": "2026-10-23",
  "principle": "Quy hoạch cấp dưới phải phù hợp quy hoạch cấp trên đang có hiệu lực. Thứ bậc: QHC 1/25.000, QHC 1/10.000, QHPK 1/2.000, QHCT 1/500. Mỗi đồ án chỉ đối chiếu với cấp trên gần nhất còn hiệu lực trong cùng phạm vi. Thiếu cấp trung gian thì đối chiếu lên cấp còn lại. Trong vùng override của schemes.json, đồ án có priority lớn hơn thay thế đồ án bị ghi đè. Giá trị rỗng hoặc bằng 0 ở trường đo đạc được coi là chưa có số liệu: quy tắc bỏ qua, không được ghi là đạt.",
  "hierarchy": [
    {
      "id": "QHC25",
      "label": "QHC 1/25.000",
      "scale": 25000,
      "rank": 1
    },
    {
      "id": "QHC10",
      "label": "QHC 1/10.000",
      "scale": 10000,
      "rank": 2
    },
    {
      "id": "QHPK",
      "label": "QHPK 1/2.000",
      "scale": 2000,
      "rank": 3
    },
    {
      "id": "QHCT",
      "label": "QHCT 1/500",
      "scale": 500,
      "rank": 4
    }
  ],
  "sectors": [
    {
      "id": "giao-thong",
      "label": "Giao thông"
    },
    {
      "id": "cap-nuoc",
      "label": "Cấp nước"
    },
    {
      "id": "cap-dien",
      "label": "Cấp điện"
    },
    {
      "id": "san-nen-thoat-mua",
      "label": "San nền và thoát nước mưa"
    },
    {
      "id": "thoat-nuoc-thai",
      "label": "Thoát nước thải"
    },
    {
      "id": "chat-thai-ran-nghia-trang",
      "label": "Chất thải rắn và nghĩa trang"
    },
    {
      "id": "thong-tin-lien-lac",
      "label": "Thông tin liên lạc"
    },
    {
      "id": "su-dung-dat",
      "label": "Sử dụng đất"
    },
    {
      "id": "ranh-gioi",
      "label": "Ranh giới"
    },
    {
      "id": "uu-tien",
      "label": "Ưu tiên đồ án"
    }
  ],
  "definitions": {
    "positionalToleranceM": {
      "QHC25": 12.5,
      "QHC10": 5,
      "QHPK": 1,
      "QHCT": 0.25
    },
    "positionalBasis": "0,5 mm trên bản vẽ theo mẫu số tỷ lệ của cấp trên. Ngưỡng nội bộ để khỏi bắt lệch do tỷ lệ vẽ. Căn cứ tiêu chuẩn độ chính xác bản đồ cần xác minh.",
    "widthToleranceM": 0.5,
    "widthBasis": "0,5 m là ngưỡng làm tròn số liệu lộ giới, không phải chỉ tiêu quy chuẩn. Cần xác minh.",
    "elevationToleranceM": 0.1,
    "elevationBasis": "0,1 m là ngưỡng làm tròn cao độ. Cần xác minh.",
    "diameterToleranceMm": 0,
    "areaRelativeTolerance": 0.02,
    "areaBasis": "2% diện tích để khỏi bắt phần vụn do dựng hình. Cần xác minh.",
    "treatZeroAsMissing": "Với trường đo (lộ giới, đường kính, công suất, diện tích, cao độ, hành lang, dung lượng), giá trị 0 và chuỗi rỗng không phải số liệu. Quy tắc trả về bỏ qua.",
    "onMissing": "bo-qua nghĩa là không kết luận đạt và không kết luận vi phạm."
  },
  "codebooks": {
    "capDuong": {
      "source": "scripts/build-qhc2045.js, hằng ROAD_CODE_10 và ROAD_LABEL_25. Chú giải gServer lớp 1/10.000, không phải mã QCVN.",
      "rankHighToLow": [
        "ct",
        "ql",
        "dt",
        "dothi",
        "kv"
      ],
      "labels": {
        "ct": "Cao tốc",
        "ql": "Quốc lộ",
        "dt": "Đường tỉnh",
        "dothi": "Trục chính đô thị",
        "kv": "Đường khu vực"
      },
      "code10": {
        "1": "ct",
        "2": "ql",
        "3": "dt",
        "5": "dothi",
        "6": "kv"
      },
      "label25": [
        {
          "pattern": "cao tốc",
          "class": "ct"
        },
        {
          "pattern": "quốc lộ",
          "class": "ql"
        },
        {
          "pattern": "tỉnh",
          "class": "dt"
        },
        {
          "pattern": "trục chính",
          "class": "dothi"
        }
      ],
      "note": "Ở 1/25.000 không dùng mã số caphangduongbo để xếp cấp. Mã 3 tại tỷ lệ này không cùng nghĩa với mã 3 tại 1/10.000."
    },
    "capDienThe": {
      "observed": [
        "Cao thế",
        "Trung thế",
        "1",
        "2",
        "3"
      ],
      "rankHighToLow": [
        "Cao thế",
        "Trung thế",
        "Hạ thế"
      ],
      "note": "Chỉ xếp hạng khi giá trị là chữ. Mã 1, 2, 3 chưa có bảng quy đổi, không gán kV."
    },
    "capNghiaTrang": {
      "observed": [
        "3",
        "4"
      ],
      "rankHighToLow": null,
      "note": "Chưa có chú giải mã capnghiatrang. Không kết luận mã nào cao hơn."
    },
    "loaiTuyenThongTin": {
      "rankHighToLow": [
        "Ngầm",
        "Nổi"
      ],
      "note": "Ngầm là yêu cầu chặt hơn. Mã số trong cùng cột chưa có chú giải thì bỏ qua."
    },
    "landUse": {
      "source": "Mã số lấy từ public/js/qhc2045.js, đối tượng LAND_CODES. Vùng 1/25.000 lấy từ cats.zones của public/data/qhc2045/dinhhuong.json.",
      "note": "Khung tối thiểu. Cặp không nằm trong forbidden và không nằm trong refine: cảnh báo, cần xác minh. Không suy ra đây là bảng đầy đủ của QCVN.",
      "groups": {
        "o": {
          "codes": [
            40
          ],
          "labels": [
            "đất đơn vị ở",
            "đất nhóm nhà ở",
            "đất ở"
          ]
        },
        "cx-cong-cong": {
          "codes": [
            5
          ],
          "labels": [
            "cây xanh sử dụng công cộng",
            "cây xanh công cộng",
            "cây xanh công viên"
          ]
        },
        "cx-khac": {
          "codes": [
            15,
            16,
            33
          ],
          "labels": [
            "cây xanh hạn chế",
            "cây xanh chuyên dụng",
            "cây xanh thể dục"
          ]
        },
        "cc": {
          "codes": [
            2
          ],
          "labels": [
            "dịch vụ - công cộng",
            "công cộng"
          ]
        },
        "gt": {
          "codes": [
            32,
            41
          ],
          "labels": [
            "đất giao thông"
          ]
        },
        "cn": {
          "codes": [
            7,
            8,
            35
          ],
          "labels": [
            "công nghiệp",
            "kho tàng",
            "công nghệ cao"
          ]
        },
        "nn": {
          "codes": [
            23,
            24,
            25,
            26
          ],
          "labels": [
            "nông nghiệp",
            "lâm nghiệp",
            "rừng"
          ]
        },
        "mn": {
          "codes": [
            29,
            30,
            31
          ],
          "labels": [
            "mặt nước",
            "sông",
            "hồ"
          ]
        },
        "nt": {
          "codes": [
            22
          ],
          "labels": [
            "nghĩa trang"
          ]
        },
        "ht": {
          "codes": [
            6,
            21
          ],
          "labels": [
            "hạ tầng kỹ thuật"
          ]
        },
        "hh": {
          "codes": [
            3
          ],
          "labels": [
            "hỗn hợp"
          ]
        },
        "dt": {
          "codes": [
            34
          ],
          "labels": [
            "dự trữ"
          ]
        },
        "ditich": {
          "codes": [
            17
          ],
          "labels": [
            "di tích",
            "tôn giáo"
          ]
        }
      },
      "refine": {
        "o": [
          "o",
          "cx-cong-cong",
          "cx-khac",
          "cc",
          "gt",
          "ht"
        ],
        "hh": [
          "o",
          "cx-cong-cong",
          "cx-khac",
          "cc",
          "gt",
          "ht",
          "hh"
        ],
        "dt": [
          "dt",
          "o",
          "cx-cong-cong",
          "cc",
          "gt",
          "ht",
          "nn"
        ],
        "cc": [
          "cc",
          "gt"
        ]
      },
      "forbidden": [
        {
          "higherGroups": [
            "cx-cong-cong",
            "nn",
            "mn",
            "nt",
            "gt"
          ],
          "lowerGroups": [
            "o",
            "cn"
          ]
        },
        {
          "higherGroups": [
            "cn"
          ],
          "lowerGroups": [
            "o"
          ]
        },
        {
          "higherGroups": [
            "ditich"
          ],
          "lowerGroups": [
            "cn"
          ]
        }
      ],
      "zones25ForbiddenLowerGroups": {
        "0": [
          "o"
        ],
        "1": [
          "o",
          "cn"
        ],
        "2": [
          "o"
        ],
        "4": [
          "o",
          "cn"
        ],
        "9": [
          "cn"
        ],
        "11": [
          "o",
          "cn"
        ],
        "12": [
          "o",
          "cn"
        ],
        "14": [
          "o",
          "cn"
        ],
        "17": [
          "o",
          "cn"
        ],
        "18": [
          "o",
          "cn"
        ]
      },
      "zoneNames": [
        "Khu vực nghĩa trang và đầu mối hạ tầng kỹ thuật",
        "Khu vực quốc phòng - an ninh",
        "Khu vực phát triển công nghiệp và công nghệ cao",
        "Khu vực công cộng - dịch vụ cấp vùng, cấp tỉnh",
        "Khu vực rừng phòng hộ",
        "Khu vực phát triển đô thị có kiểm soát",
        "Đất hỗn hợp",
        "Khu vực khai thác khoáng sản",
        "Khu vực dân cư nông thôn",
        "Khu vực hoàng thành, di tích, tôn giáo",
        "Khu vực nghiên cứu, đào tạo cấp vùng, cấp tỉnh",
        "Khu vực rừng đặc dụng",
        "Khu vực rừng sản xuất",
        "Khu vực phát triển đô thị",
        "Khu vực bãi bồi, bãi cát",
        "Khu vực dự trữ phát triển",
        "Khu vực phát triển du lịch tập trung",
        "Khu vực nông nghiệp và phát triển nông thôn",
        "Giao thông"
      ]
    }
  },
  "sources": {
    "chuyenNganh": "data/chuyen-nganh/<scheme>/<sector>/quy-hoach/*.geojson. Tên trường đầy đủ nằm ở file *-ten-truong.txt cạnh shapefile. Giá trị 0 trên trường đo được coi là chưa có số.",